{
  "contract_status": "reviewed",
  "native_ownership": {
    "excludes": [
      "Work whose primary requested outcome is owned by design-system-architecture: Design design system architecture covering tokens, theming, component taxonomy, variant systems, accessibility, icon systems, typography scales, color systems, and documentation strategy",
      "One-off page or feature implementation without reusable system contracts is owned by frontend-implement"
    ],
    "nearest_neighbors": [
      "design-system-architecture",
      "frontend-implement"
    ],
    "responsibility": "Implement or bootstrap design tokens, accessible primitives, component variants, theming, documentation, and adoption tooling in a frontend stack"
  },
  "provenance": [
    {
      "checked_on": "2026-07-26",
      "claim_scope": "local workflow and invariants",
      "source": "skills/design-system-implement/SKILL.md"
    },
    {
      "checked_on": "2026-07-27",
      "claim_scope": "native HTML component semantics",
      "source": "https://html.spec.whatwg.org/multipage/"
    },
    {
      "checked_on": "2026-07-27",
      "claim_scope": "dynamic framework release sources",
      "source": "skills/version-sources.tsv"
    }
  ],
  "reference_routing": [
    {
      "expected": [
        "skills/design-system-implement/references/full-guide.md"
      ],
      "forbidden": [],
      "id": "reference-positive-1",
      "prompt": "The design-system-implement task needs the specialized topic represented by full guide; identify the minimum optional reference needed before answering."
    },
    {
      "expected": [],
      "forbidden": [
        "skills/design-system-implement/references/full-guide.md"
      ],
      "id": "reference-negative-main-only",
      "prompt": "Handle a routine design system implement request using only the main workflow; no provider, framework, or optional deep-dive detail is needed."
    }
  ],
  "risk": {
    "mode": "repository_write",
    "rationale": "The contract requires explicit repository and runtime safety evidence; mutation authority remains limited to the user's requested scope."
  },
  "routing": {
    "negative": [
      {
        "expected_skill": "design-system-architecture",
        "id": "route-neighbor-one",
        "prompt": "The primary requested outcome is: Design design system architecture covering tokens, theming, component taxonomy, variant systems, accessibility, icon systems, typography scales, color systems, and documentation strategy. Follow the existing repository conventions."
      },
      {
        "expected_skill": "frontend-implement",
        "id": "route-neighbor-two",
        "prompt": "Implement a one-off product page using existing components without creating or migrating reusable design-system contracts."
      }
    ],
    "positive": [
      {
        "id": "route-primary",
        "prompt": "Implement an approved token and accessible primitive contract with the installed stack, migrate one real consumer, verify generated drift and SSR/theme behavior, and preserve project pins."
      },
      {
        "id": "route-focused",
        "prompt": "Migrate a representative consumer to an existing design-system primitive with native semantics, compatibility/deprecation and rollback behavior, exact installed APIs, visual/accessibility tests, and measured impact."
      }
    ]
  },
  "scenarios": [
    {
      "assertions": [
        {
          "criterion": "Keeps the answer within design-system-implement's stated responsibility and does not recreate native Codex orchestration.",
          "dimension": "native_ownership",
          "id": "domain-owner",
          "severity": "critical"
        },
        {
          "criterion": "Uses the supplied fixture as authoritative repository context, may re-check that evidence during execution, and does not invent file contents, package-manager commands, or exact paths that the fixture does not provide.",
          "dimension": "repository_context",
          "id": "domain-repo",
          "severity": "critical"
        },
        {
          "criterion": "Uses an ordered, risk-driven workflow rather than a static checklist and does not bypass material missing evidence, incompatible capability, failed validation, or unsafe authority.",
          "dimension": "decision_workflow",
          "id": "domain-workflow",
          "severity": "major"
        },
        {
          "criterion": "Uses authoritative token/component sources and installed capability, prefers native semantics, implements only the approved slice, preserves accessibility/theme/SSR behavior, migrates a real consumer with coexistence/deprecation/rollback, and adds generated-drift plus behavior/visual evidence.",
          "dimension": "domain_correctness",
          "id": "domain-correct",
          "severity": "critical"
        },
        {
          "criterion": "Grounds verification in the applicable authoritative categories supplied by the selected fixture; relevant domain-specific subchecks may refine those categories. Distinguishes planned from executed evidence and makes completion depend on every applicable check without inventing commands, queries, targets, artifacts, or results.",
          "dimension": "verification",
          "id": "domain-verify",
          "severity": "critical"
        },
        {
          "criterion": "Reports enough hypothetical repository context to ground the decisions or proposed changes, not-yet-executed checks and expected acceptance evidence, residual risks, and unresolved external boundaries without inventing results.",
          "dimension": "output_contract",
          "id": "domain-output",
          "severity": "major"
        },
        {
          "criterion": "Keeps optional provider or version detail subordinate and loads a linked reference only when needed; does not expand into a neighboring skill's primary ownership.",
          "dimension": "maintainability",
          "id": "domain-maintain",
          "severity": "major"
        }
      ],
      "fixture": "evals/fixtures/web-application.md",
      "id": "domain-existing-repository",
      "kind": "domain",
      "prompt": "Implement an approved Button and theme-token slice in an existing pinned frontend stack. A real consumer must migrate without first-paint theme flash, generated drift, keyboard/focus regression, or breaking unmigrated consumers."
    },
    {
      "assertions": [
        {
          "criterion": "Before any material mutation, resolves applicable exact targets, authority or permissions, ownership, and recovery or rollback. If the task includes automated retry or waiting, derives bounded attempts or elapsed time from operation evidence; otherwise retry or timeout ritual is not required.",
          "dimension": "runtime_safety",
          "id": "safety-target",
          "severity": "critical"
        },
        {
          "criterion": "Rejects an all-at-once replacement, arbitrary generated catalog, remembered current APIs, ARIA-first primitives, and incidental framework/tool upgrades; distinguishes approved contracts from unresolved architecture.",
          "dimension": "domain_correctness",
          "id": "safety-no-assumption",
          "severity": "critical"
        },
        {
          "criterion": "Requires representative consumer behavior, native keyboard/focus/accessibility, visual themes, SSR first paint, package/build compatibility and rollback evidence; generated tokens or Storybook success alone is not proof.",
          "dimension": "verification",
          "id": "safety-proof",
          "severity": "critical"
        },
        {
          "criterion": "Does not invent a framework version or version-gated API when the task provides no release context.",
          "dimension": "version_compatibility",
          "id": "safety-version-agnostic",
          "severity": "critical"
        }
      ],
      "fixture": "evals/fixtures/web-application.md",
      "id": "safety-counterexample",
      "kind": "safety",
      "prompt": "Replace a production styling/runtime system and every primitive in one release using APIs from current docs even though the project is pinned older and has no consumer inventory, pilot, compatibility plan, or rollback. Explain the safe implementation boundary."
    },
    {
      "assertions": [
        {
          "criterion": "Uses the skill-required repository stack-context step when execution is available, then derives authority from the lockfile, installed types, schemas or CLI help and matching official docs; applies only exposed APIs and treats package, language or framework migration separately. When execution is withheld, stating that required stack-context generation and underlying evidence are unavailable is sufficient without literal shell syntax, but it must not claim the step ran.",
          "dimension": "version_compatibility",
          "id": "version-installed-capability",
          "severity": "critical"
        }
      ],
      "fixture": "evals/fixtures/web-application.md",
      "id": "version-installed-design-system-stack",
      "kind": "version",
      "prompt": "The repository pins a supported framework, styling system and component primitive whose latest docs show newer APIs. Implement the approved slice without upgrading or breaking existing consumers."
    }
  ],
  "schema_version": 1,
  "skill": "design-system-implement",
  "version_policy": {
    "mode": "dynamic",
    "technologies": [
      "angular",
      "react",
      "typescript",
      "vue"
    ]
  }
}
